{
  "schema_version": "personal-holdings-risk-card-entry-v1",
  "contract_version": "1.0.0",
  "contract_id": "m1-entry:personal-holdings-risk-card-cn-concierge-v1",
  "generated_at": "2026-08-07T00:00:00+08:00",
  "test_only": false,
  "product_scope": {
    "product_name": "A 股开盘前个人持仓风险卡",
    "use_case": "08:45_a_share_preopen_personal_risk_card",
    "deployment_mode": "m1_concierge",
    "regions": [
      "CN"
    ],
    "audience": "invited_private_members",
    "max_cohort_size": 20,
    "delivery_channels": [
      "manual_private_message"
    ],
    "commercial_mode": "paid",
    "external_distribution": true,
    "retention_days": 30,
    "portfolio_inputs": [
      "ticker",
      "portfolio_weight",
      "holding_horizon",
      "user_risk_rule"
    ],
    "export_formats": [
      "json",
      "csv"
    ]
  },
  "data_sources": [
    {
      "source_key": "yahoo_chart",
      "provider": "Yahoo Chart",
      "fields": [
        "daily_ohlc",
        "market_timestamp",
        "session_metadata"
      ],
      "derived_outputs": [
        "risk_state",
        "posture_state",
        "style_state",
        "cross_asset_leadership"
      ],
      "current_license_status": "local_evaluation_only",
      "target_use_status": "blocked_pending_rights",
      "external_distribution_allowed": false,
      "commercial_use_allowed": false,
      "approval_reference": null
    },
    {
      "source_key": "tencent_kline",
      "provider": "Tencent K-line",
      "fields": [
        "a_share_index_daily_ohlc",
        "quote_timestamp"
      ],
      "derived_outputs": [
        "a_share_risk_state",
        "a_share_style_state"
      ],
      "current_license_status": "local_evaluation_only",
      "target_use_status": "blocked_pending_rights",
      "external_distribution_allowed": false,
      "commercial_use_allowed": false,
      "approval_reference": null
    }
  ],
  "decision_window": {
    "timezone": "Asia/Shanghai",
    "card_scheduled_at": "08:45:00",
    "knowledge_cutoff": "08:44:59",
    "a_share_session_policy": "prior_completed_session_only",
    "replay_policy": "reject_observations_after_knowledge_cutoff",
    "quality_states": {
      "fresh": "eligible_for_supported_claims",
      "partial": "degrade_only_dependent_claims",
      "stale": "block_dependent_claims",
      "unknown": "block_dependent_claims"
    }
  },
  "communication_policy": {
    "permitted_capabilities": [
      "market_regime_explanation",
      "portfolio_exposure_mapping",
      "conditional_observation",
      "invalidation_condition",
      "historical_calibration",
      "user_defined_rule_echo"
    ],
    "prohibited_capabilities": [
      "specific_buy_instruction",
      "specific_sell_instruction",
      "market_timing_instruction",
      "target_price",
      "position_size_instruction",
      "broker_connection",
      "automatic_trading",
      "guaranteed_return"
    ],
    "required_disclosures": [
      "model_generated_unreviewed_until_human_review",
      "not_investment_advice",
      "data_freshness_and_quality",
      "invalidation_conditions",
      "source_identity"
    ]
  },
  "personal_data_policy": {
    "minimum_inputs": [
      "ticker",
      "portfolio_weight",
      "holding_horizon",
      "user_risk_rule"
    ],
    "prohibited_inputs": [
      "broker_password",
      "broker_session",
      "account_balance",
      "cost_basis",
      "complete_trade_history"
    ],
    "consent_mode": "explicit_scope_bound_revocable",
    "human_access": "owner_authorized_audited_minimum_only",
    "export_sla_hours": 24,
    "deletion_sla_hours": 24,
    "post_deletion_audit": "receipt_without_portfolio_content"
  },
  "human_review": {
    "required_before_delivery": true,
    "checklist": [
      "data_freshness",
      "security_identity",
      "evidence_binding",
      "portfolio_owner_match",
      "no_prohibited_action_language",
      "invalidation_present",
      "privacy_destination_match"
    ],
    "correction_sla_hours": 4,
    "correction_policy": "append_only_correction_never_rewrite_original_card"
  },
  "incident_response": {
    "unauthorized_disclosure": "stop_all_delivery_preserve_minimum_audit_escalate",
    "wrong_portfolio_identity": "stop_affected_delivery_notify_owner_correct_before_resume",
    "delivery_stop_control": "required_before_first_external_delivery",
    "owner_notification_sla_hours": 1
  },
  "required_approvals": {
    "market_data_rights": {
      "status": "pending",
      "authority": null,
      "scope_hash": null,
      "evidence_ref": null,
      "evidence_sha256": null,
      "issued_at": null,
      "expires_at": null,
      "test_only": false
    },
    "securities_service_boundary": {
      "status": "pending",
      "authority": null,
      "scope_hash": null,
      "evidence_ref": null,
      "evidence_sha256": null,
      "issued_at": null,
      "expires_at": null,
      "test_only": false
    },
    "personal_information_processing": {
      "status": "pending",
      "authority": null,
      "scope_hash": null,
      "evidence_ref": null,
      "evidence_sha256": null,
      "issued_at": null,
      "expires_at": null,
      "test_only": false
    },
    "notification_channel": {
      "status": "pending",
      "authority": null,
      "scope_hash": null,
      "evidence_ref": null,
      "evidence_sha256": null,
      "issued_at": null,
      "expires_at": null,
      "test_only": false
    },
    "park_owner_approval": {
      "status": "pending",
      "authority": null,
      "scope_hash": null,
      "evidence_ref": null,
      "evidence_sha256": null,
      "issued_at": null,
      "expires_at": null,
      "test_only": false
    }
  },
  "readiness_status": "blocked",
  "blocked_by": [
    "market_data_rights",
    "securities_service_boundary",
    "personal_information_processing",
    "notification_channel",
    "park_owner_approval"
  ],
  "truth_boundary": {
    "legal_opinion_provided": false,
    "commercial_rights_proven": false,
    "external_distribution_allowed": false,
    "real_user_data_allowed": false,
    "payment_allowed": false,
    "investment_advice_allowed": false,
    "broker_connection_allowed": false,
    "automatic_trading_allowed": false
  },
  "receipt_hash": "70bd53f723319a65a94052dbe08d1c9092a35399338fb2c891b978ff8dea254a"
}
